{
  "clubName": "Demo Single Club",
  "siteMode": "single",
  "advisorName": "Mr. Daniel Ortega",
  "description": "The Example Club brings together players of every skill level — from first-time pawns to seasoned tacticians. We meet weekly to play, study famous games, run friendly ladder tournaments, and prepare for regional scholastic competitions. No experience required; boards and coaching provided.",
  "meetingTime": "Thursdays, 3:30–5:00 PM in Room 214",
  "officers": [
    { "name": "Ava Chen",     "role": "President" },
    { "name": "Marcus Bell",  "role": "Vice President" },
    { "name": "Priya Nair",   "role": "Tournament Director" },
    { "name": "Leo Kowalski", "role": "Treasurer" }
  ],
  "events": [
    { "title": "Fall Blitz Tournament",            "date": "2025-10-18", "description": "Fast-paced 5-minute games, open to all members. Prizes for the top three finishers." },
    { "title": "Grandmaster Game Review Night",    "date": "2025-11-13", "description": "We break down a classic World Championship game move by move — bring a notebook." },
    { "title": "Winter Simul with Local Master",   "date": "2025-12-05", "description": "A visiting master plays every club member simultaneously across 15 boards." },
    { "title": "New Year Puzzle Rush",             "date": "2026-01-09", "description": "Timed tactics puzzles in teams of two — no board experience required to join in." },
    { "title": "Regional Qualifier Prep Session",  "date": "2026-02-20", "description": "Focused opening prep and endgame drills ahead of the regional qualifiers." },
    { "title": "Spring Championship",              "date": "2026-04-17", "description": "Our biggest event of the year — a full round-robin club championship." }
  ],
  "awards": [
    { "title": "Regional Scholastic Team — 1st Place",             "year": 2024 },
    { "title": "District Chess Championship — Runner-up",          "year": 2023 },
    { "title": "State Scholastic Blitz — 3rd Place",                "year": 2024 },
    { "title": "Best New Club Award — District Activities Board",  "year": 2022 },
    { "title": "Regional Scholastic Team — 2nd Place",              "year": 2022 },
    { "title": "Chapter of the Year (Honorable Mention)",           "year": 2023 },
    { "title": "County Team Championship — 1st Place",              "year": 2025 },
    { "title": "Individual State Qualifier — Ava Chen",             "year": 2025 }
  ],
  "images": ["board.jpg", "tournament.jpg", "team.jpg"]
}